{
  "$schema": "https://json-schema.org/draft/2020-12/schema",
  "$id": "https://atlas.dev/schema/atlas.schema.json",
  "title": "Atlas Configuration",
  "description": "Defines version-one Atlas workspace discovery, artifact, and layout policy.",
  "type": "object",
  "additionalProperties": false,
  "required": ["schemaVersion", "discovery"],
  "properties": {
    "schemaVersion": {
      "description": "Identifies the supported Atlas configuration schema version.",
      "const": 1
    },
    "discovery": {
      "description": "Defines package discovery and explicit classification policy.",
      "type": "object",
      "additionalProperties": false,
      "required": ["packages"],
      "properties": {
        "packageGlobs": {
          "description": "Matches package directories relative to the workspace root.",
          "type": "array",
          "items": { "type": "string", "minLength": 1 },
          "minItems": 1,
          "uniqueItems": true
        },
        "excludePackageGlobs": {
          "description": "Excludes package directories before policy matching.",
          "type": "array",
          "items": { "type": "string", "minLength": 1 },
          "uniqueItems": true
        },
        "defaultSourceRoots": {
          "description": "Defines source roots used when package policies do not override them.",
          "type": "array",
          "items": { "type": "string", "minLength": 1 },
          "minItems": 1,
          "uniqueItems": true
        },
        "packages": {
          "description": "Defines explicit classification policies for included packages.",
          "type": "array",
          "items": { "$ref": "#/$defs/packagePolicy" },
          "minItems": 1
        }
      }
    },
    "artifacts": {
      "description": "Defines the artifact output root.",
      "type": "object",
      "additionalProperties": false,
      "properties": {
        "root": {
          "description": "Names the artifact output directory.",
          "type": "string",
          "minLength": 1
        }
      }
    },
    "layout": {
      "description": "Defines default deterministic layout settings.",
      "type": "object",
      "additionalProperties": false,
      "properties": {
        "orientation": {
          "description": "Defines the primary layout axis.",
          "enum": ["horizontal", "vertical"]
        },
        "rows": {
          "description": "Limits sibling items in each generated row.",
          "type": "integer",
          "minimum": 1
        },
        "horizontalGap": {
          "description": "Defines the minimum horizontal gap between item bounds.",
          "type": "number",
          "minimum": 0
        },
        "verticalGap": {
          "description": "Defines the minimum vertical gap between item bounds.",
          "type": "number",
          "minimum": 0
        }
      }
    },
    "diagrams": {
      "description": "Defines generated diagram graph-shaping policy and opt-in folder scopes.",
      "$ref": "#/$defs/diagramConfiguration"
    },
    "rules": {
      "description": "Declares architecture policies Atlas evaluates during validation.",
      "type": "array",
      "items": { "$ref": "#/$defs/architectureRule" },
      "uniqueItems": true
    },
    "layers": {
      "description": "Defines optional named source layers for dependency direction rules.",
      "type": "array",
      "items": { "$ref": "#/$defs/layerDefinition" },
      "uniqueItems": true
    }
  },
  "$defs": {
    "diagramConfiguration": {
      "description": "Configures generated diagram inclusion and external-dependency rendering.",
      "type": "object",
      "additionalProperties": false,
      "properties": {
        "excludeSourceGlobs": {
          "description": "Excludes local declarations whose workspace-relative source paths match a glob.",
          "type": "array",
          "items": { "type": "string", "minLength": 1 },
          "uniqueItems": true
        },
        "excludeExternalDependencies": {
          "description": "Excludes external dependency labels matching a glob.",
          "type": "array",
          "items": { "type": "string", "minLength": 1 },
          "uniqueItems": true
        },
        "collapseExternalDependencies": {
          "description": "Collapses visible external dependencies to package-level nodes.",
          "type": "boolean"
        },
        "collapseExternalDependencyGlobs": {
          "description": "Collapses matching external dependency labels when global collapsing is disabled.",
          "type": "array",
          "items": { "type": "string", "minLength": 1 },
          "uniqueItems": true
        },
        "splitExternalDependenciesByImporter": {
          "description": "Splits landscape external dependencies by importing workspace package.",
          "type": "boolean"
        },
        "externalDependencyImporterSplits": {
          "description": "Selectively splits matching landscape external dependencies by importing package.",
          "type": "array",
          "items": { "$ref": "#/$defs/externalDependencyImporterSplit" },
          "uniqueItems": true
        },
        "packages": {
          "description": "Defines package-specific declaration exclusion policy.",
          "type": "array",
          "items": { "$ref": "#/$defs/packageDiagramConfiguration" },
          "uniqueItems": true
        },
        "folders": {
          "description": "Declares opt-in package-local folder diagrams.",
          "type": "array",
          "items": { "$ref": "#/$defs/folderDiagramConfiguration" },
          "uniqueItems": true
        }
      }
    },
    "folderDiagramConfiguration": {
      "description": "Configures one package-local folder diagram with inherited or overridden graph policy.",
      "type": "object",
      "additionalProperties": false,
      "required": ["packageName", "path"],
      "properties": {
        "packageName": {
          "description": "Names the explicitly discovered package that owns the folder.",
          "type": "string",
          "minLength": 1
        },
        "path": {
          "description": "Names a normalized folder path relative to the package root.",
          "type": "string",
          "minLength": 1,
          "pattern": "^(?!/)(?!.*(?:^|/)\\.\\.(?:/|$)).+$"
        },
        "title": {
          "description": "Optionally overrides the generated folder diagram title.",
          "type": "string",
          "minLength": 1
        },
        "excludeSourceGlobs": {
          "description": "Adds source-node exclusions to inherited graph policy.",
          "type": "array",
          "items": { "type": "string", "minLength": 1 },
          "uniqueItems": true
        },
        "excludeExternalDependencies": {
          "description": "Adds external dependency exclusions to inherited graph policy.",
          "type": "array",
          "items": { "type": "string", "minLength": 1 },
          "uniqueItems": true
        },
        "collapseExternalDependencies": {
          "description": "Optionally overrides inherited external collapse behavior.",
          "type": "boolean"
        },
        "splitExternalDependenciesByImporter": {
          "description": "Optionally overrides inherited external splitting behavior.",
          "type": "boolean"
        },
        "externalDependencyImporterSplits": {
          "description": "Adds selective external dependency importer splits to inherited policy.",
          "type": "array",
          "items": { "$ref": "#/$defs/externalDependencyImporterSplit" },
          "uniqueItems": true
        }
      }
    },
    "externalDependencyImporterSplit": {
      "description": "Splits one external dependency for selected importing workspace packages.",
      "type": "object",
      "additionalProperties": false,
      "required": ["dependency", "packageNames"],
      "properties": {
        "dependency": {
          "description": "Matches one external dependency label using a glob pattern.",
          "type": "string",
          "minLength": 1
        },
        "packageNames": {
          "description": "Names importing workspace packages receiving separate dependency nodes.",
          "type": "array",
          "minItems": 1,
          "uniqueItems": true,
          "items": { "type": "string", "minLength": 1 }
        }
      }
    },
    "packageDiagramConfiguration": {
      "description": "Configures source-node exclusions for one explicitly discovered package.",
      "type": "object",
      "additionalProperties": false,
      "required": ["packageName"],
      "properties": {
        "packageName": {
          "description": "Names the explicitly discovered package that owns the declarations.",
          "type": "string",
          "minLength": 1
        },
        "excludeSourceGlobs": {
          "description": "Adds source-node exclusions for declarations in this package.",
          "type": "array",
          "items": { "type": "string", "minLength": 1 },
          "uniqueItems": true
        }
      }
    },
    "packagePolicy": {
      "description": "Classifies one selected package and its source roots.",
      "type": "object",
      "additionalProperties": false,
      "required": ["match", "classification"],
      "properties": {
        "match": { "$ref": "#/$defs/packageMatch" },
        "classification": {
          "description": "Identifies runtime or support package membership.",
          "enum": ["runtime", "support"]
        },
        "classes": {
          "description": "Adds stable user-defined package class labels.",
          "type": "array",
          "items": { "type": "string", "minLength": 1 },
          "uniqueItems": true
        },
        "sourceRoots": {
          "description": "Overrides default source roots relative to the package root.",
          "type": "array",
          "items": { "type": "string", "minLength": 1 },
          "minItems": 1,
          "uniqueItems": true
        },
        "tsconfig": {
          "description": "Names an optional TypeScript configuration file relative to the package root.",
          "type": "string",
          "minLength": 1
        }
      }
    },
    "packageMatch": {
      "description": "Matches a package manifest name, directory path, or both.",
      "type": "object",
      "additionalProperties": false,
      "minProperties": 1,
      "properties": {
        "name": {
          "description": "Matches a package manifest name using a glob pattern.",
          "type": "string",
          "minLength": 1
        },
        "path": {
          "description": "Matches a workspace-relative package directory path using a glob pattern.",
          "type": "string",
          "minLength": 1
        }
      }
    },
    "architectureRule": {
      "description": "Defines one supported architecture validation rule.",
      "oneOf": [
        { "$ref": "#/$defs/noCircularRule" },
        { "$ref": "#/$defs/noRuntimeToSupportRule" },
        { "$ref": "#/$defs/dependencyDirectionRule" },
        { "$ref": "#/$defs/forbiddenImportRule" },
        { "$ref": "#/$defs/forbiddenExternalRule" }
      ]
    },
    "noCircularRule": {
      "description": "Rejects circular dependencies reported by the analysis adapter.",
      "type": "object",
      "additionalProperties": false,
      "required": ["id", "type", "severity"],
      "properties": {
        "id": {
          "description": "Uniquely identifies this rule in the configuration document.",
          "type": "string",
          "minLength": 1
        },
        "type": {
          "description": "Identifies circular dependency policy behavior.",
          "const": "no-circular"
        },
        "severity": {
          "description": "Determines whether violations fail the command.",
          "enum": ["error", "warning"]
        }
      }
    },
    "noRuntimeToSupportRule": {
      "description": "Rejects dependencies from runtime packages to support packages.",
      "type": "object",
      "additionalProperties": false,
      "required": ["id", "type", "severity"],
      "properties": {
        "id": {
          "description": "Uniquely identifies this rule in the configuration document.",
          "type": "string",
          "minLength": 1
        },
        "type": {
          "description": "Identifies runtime-to-support dependency policy behavior.",
          "const": "no-runtime-to-support"
        },
        "severity": {
          "description": "Determines whether violations fail the command.",
          "enum": ["error", "warning"]
        }
      }
    },
    "dependencyDirectionRule": {
      "description": "Restricts dependency directions between selected packages or layers.",
      "type": "object",
      "additionalProperties": false,
      "required": ["id", "type", "severity", "mode", "from", "to"],
      "properties": {
        "id": { "description": "Uniquely identifies this rule.", "type": "string", "minLength": 1 },
        "type": {
          "description": "Identifies dependency direction behavior.",
          "const": "dependency-direction"
        },
        "severity": {
          "description": "Determines command failure behavior.",
          "enum": ["error", "warning"]
        },
        "mode": {
          "description": "Allows only selected targets or forbids selected targets.",
          "enum": ["allow-only", "forbid"]
        },
        "from": {
          "description": "Selects importing packages or layers.",
          "$ref": "#/$defs/ruleSelector"
        },
        "to": {
          "description": "Selects allowed or forbidden targets.",
          "$ref": "#/$defs/ruleSelector"
        }
      }
    },
    "forbiddenImportRule": {
      "description": "Rejects configured import specifier patterns.",
      "type": "object",
      "additionalProperties": false,
      "required": ["id", "type", "severity", "patterns"],
      "properties": {
        "id": { "description": "Uniquely identifies this rule.", "type": "string", "minLength": 1 },
        "type": {
          "description": "Identifies forbidden import behavior.",
          "const": "forbidden-import"
        },
        "severity": {
          "description": "Determines command failure behavior.",
          "enum": ["error", "warning"]
        },
        "from": {
          "description": "Optionally selects importing packages or layers.",
          "$ref": "#/$defs/ruleSelector"
        },
        "patterns": {
          "description": "Lists forbidden import-specifier globs.",
          "type": "array",
          "minItems": 1,
          "uniqueItems": true,
          "items": { "type": "string", "minLength": 1 }
        }
      }
    },
    "forbiddenExternalRule": {
      "description": "Rejects configured external package imports.",
      "type": "object",
      "additionalProperties": false,
      "required": ["id", "type", "severity", "packages"],
      "properties": {
        "id": { "description": "Uniquely identifies this rule.", "type": "string", "minLength": 1 },
        "type": {
          "description": "Identifies forbidden external behavior.",
          "const": "forbidden-external"
        },
        "severity": {
          "description": "Determines command failure behavior.",
          "enum": ["error", "warning"]
        },
        "from": {
          "description": "Optionally selects importing packages or layers.",
          "$ref": "#/$defs/ruleSelector"
        },
        "packages": {
          "description": "Lists forbidden external package-root globs.",
          "type": "array",
          "minItems": 1,
          "uniqueItems": true,
          "items": { "type": "string", "minLength": 1 }
        }
      }
    },
    "ruleSelector": {
      "description": "Selects packages and source paths by package names, classes, or layers.",
      "type": "object",
      "additionalProperties": false,
      "minProperties": 1,
      "properties": {
        "packageNames": {
          "description": "Matches exact discovered package names.",
          "type": "array",
          "minItems": 1,
          "uniqueItems": true,
          "items": { "type": "string", "minLength": 1 }
        },
        "packageClasses": {
          "description": "Matches configured package classes.",
          "type": "array",
          "minItems": 1,
          "uniqueItems": true,
          "items": { "type": "string", "minLength": 1 }
        },
        "layers": {
          "description": "Matches configured source layer names.",
          "type": "array",
          "minItems": 1,
          "uniqueItems": true,
          "items": { "type": "string", "minLength": 1 }
        }
      }
    },
    "layerDefinition": {
      "description": "Defines a named workspace-relative source layer.",
      "type": "object",
      "additionalProperties": false,
      "required": ["name", "sourceGlobs"],
      "properties": {
        "name": {
          "description": "Uniquely identifies the layer.",
          "type": "string",
          "minLength": 1
        },
        "sourceGlobs": {
          "description": "Lists workspace-relative source path globs in the layer.",
          "type": "array",
          "minItems": 1,
          "uniqueItems": true,
          "items": { "type": "string", "minLength": 1 }
        },
        "packageNames": {
          "description": "Optionally limits the layer to exact discovered package names.",
          "type": "array",
          "minItems": 1,
          "uniqueItems": true,
          "items": { "type": "string", "minLength": 1 }
        }
      }
    }
  }
}
